.1.3.6.1.2.1.1.3.0
.1.3.6.1.2.1.2.2.1.11.1001
.1.3.6.1.2.1.2.2.1.11.1002
.1.3.6.1.2.1.2.2.1.11.1003
.1.3.6.1.2.1.2.2.1.11.1004
.1.3.6.1.2.1.2.2.1.11.1005
.1.3.6.1.2.1.2.2.1.11.1006
.1.3.6.1.2.1.2.2.1.11.1007
.1.3.6.1.2.1.2.2.1.11.1008
.1.3.6.1.2.1.2.2.1.11.1009
.1.3.6.1.2.1.2.2.1.11.1010
.1.3.6.1.2.1.2.2.1.11.1011
.1.3.6.1.2.1.2.2.1.11.1012
.1.3.6.1.2.1.2.2.1.11.1013
.1.3.6.1.2.1.2.2.1.11.1014
.1.3.6.1.2.1.2.2.1.11.1015
.1.3.6.1.2.1.2.2.1.11.1016
.1.3.6.1.2.1.2.2.1.11.1017
.1.3.6.1.2.1.2.2.1.11.1018
.1.3.6.1.2.1.2.2.1.11.1019
.1.3.6.1.2.1.2.2.1.11.1020
.1.3.6.1.2.1.2.2.1.11.1021
.1.3.6.1.2.1.2.2.1.11.1049
.1.3.6.1.2.1.2.2.1.11.1050
.1.3.6.1.2.1.2.2.1.11.1051
.1.3.6.1.2.1.2.2.1.11.1052
.1.3.6.1.2.1.2.2.1.11.15004
.1.3.6.1.2.1.2.2.1.13.1001
.1.3.6.1.2.1.2.2.1.13.1002
.1.3.6.1.2.1.2.2.1.13.1003
.1.3.6.1.2.1.2.2.1.13.1004
.1.3.6.1.2.1.2.2.1.13.1005
.1.3.6.1.2.1.2.2.1.13.1006
.1.3.6.1.2.1.2.2.1.13.1007
.1.3.6.1.2.1.2.2.1.13.1008
.1.3.6.1.2.1.2.2.1.13.1009
.1.3.6.1.2.1.2.2.1.13.1010
.1.3.6.1.2.1.2.2.1.13.1011
.1.3.6.1.2.1.2.2.1.13.1012
.1.3.6.1.2.1.2.2.1.13.1013
.1.3.6.1.2.1.2.2.1.13.1014
.1.3.6.1.2.1.2.2.1.13.1015
.1.3.6.1.2.1.2.2.1.13.1016
.1.3.6.1.2.1.2.2.1.13.1017
.1.3.6.1.2.1.2.2.1.13.1018
.1.3.6.1.2.1.2.2.1.13.1019
.1.3.6.1.2.1.2.2.1.13.1020
.1.3.6.1.2.1.2.2.1.13.1021
.1.3.6.1.2.1.2.2.1.13.1049
.1.3.6.1.2.1.2.2.1.13.1050
.1.3.6.1.2.1.2.2.1.13.1051
.1.3.6.1.2.1.2.2.1.13.1052
.1.3.6.1.2.1.2.2.1.13.15004
.1.3.6.1.2.1.2.2.1.14.1001
.1.3.6.1.2.1.2.2.1.14.1002
.1.3.6.1.2.1.2.2.1.14.1003
.1.3.6.1.2.1.2.2.1.14.1004
.1.3.6.1.2.1.2.2.1.14.1005
.1.3.6.1.2.1.2.2.1.14.1006
.1.3.6.1.2.1.2.2.1.14.1007
.1.3.6.1.2.1.2.2.1.14.1008
.1.3.6.1.2.1.2.2.1.14.1009
.1.3.6.1.2.1.2.2.1.14.1010
.1.3.6.1.2.1.2.2.1.14.1011
.1.3.6.1.2.1.2.2.1.14.1012
.1.3.6.1.2.1.2.2.1.14.1013
.1.3.6.1.2.1.2.2.1.14.1014
.1.3.6.1.2.1.2.2.1.14.1015
.1.3.6.1.2.1.2.2.1.14.1016
.1.3.6.1.2.1.2.2.1.14.1017
.1.3.6.1.2.1.2.2.1.14.1018
.1.3.6.1.2.1.2.2.1.14.1019
.1.3.6.1.2.1.2.2.1.14.1020
.1.3.6.1.2.1.2.2.1.14.1021
.1.3.6.1.2.1.2.2.1.14.1049
.1.3.6.1.2.1.2.2.1.14.1050
.1.3.6.1.2.1.2.2.1.14.1051
.1.3.6.1.2.1.2.2.1.14.1052
.1.3.6.1.2.1.2.2.1.14.15004
.1.3.6.1.2.1.2.2.1.17.1001
.1.3.6.1.2.1.2.2.1.17.1002
.1.3.6.1.2.1.2.2.1.17.1003
.1.3.6.1.2.1.2.2.1.17.1004
.1.3.6.1.2.1.2.2.1.17.1005
.1.3.6.1.2.1.2.2.1.17.1006
.1.3.6.1.2.1.2.2.1.17.1007
.1.3.6.1.2.1.2.2.1.17.1008
.1.3.6.1.2.1.2.2.1.17.1009
.1.3.6.1.2.1.2.2.1.17.1010
.1.3.6.1.2.1.2.2.1.17.1011
.1.3.6.1.2.1.2.2.1.17.1012
.1.3.6.1.2.1.2.2.1.17.1013
.1.3.6.1.2.1.2.2.1.17.1014
.1.3.6.1.2.1.2.2.1.17.1015
.1.3.6.1.2.1.2.2.1.17.1016
.1.3.6.1.2.1.2.2.1.17.1017
.1.3.6.1.2.1.2.2.1.17.1018
.1.3.6.1.2.1.2.2.1.17.1019
.1.3.6.1.2.1.2.2.1.17.1020
.1.3.6.1.2.1.2.2.1.17.1021
.1.3.6.1.2.1.2.2.1.17.1049
.1.3.6.1.2.1.2.2.1.17.1050
.1.3.6.1.2.1.2.2.1.17.1051
.1.3.6.1.2.1.2.2.1.17.1052
.1.3.6.1.2.1.2.2.1.17.15004
.1.3.6.1.2.1.2.2.1.19.1001
.1.3.6.1.2.1.2.2.1.19.1002
.1.3.6.1.2.1.2.2.1.19.1003
.1.3.6.1.2.1.2.2.1.19.1004
.1.3.6.1.2.1.2.2.1.19.1005
.1.3.6.1.2.1.2.2.1.19.1006
.1.3.6.1.2.1.2.2.1.19.1007
.1.3.6.1.2.1.2.2.1.19.1008
.1.3.6.1.2.1.2.2.1.19.1009
.1.3.6.1.2.1.2.2.1.19.1010
.1.3.6.1.2.1.2.2.1.19.1011
.1.3.6.1.2.1.2.2.1.19.1012
.1.3.6.1.2.1.2.2.1.19.1013
.1.3.6.1.2.1.2.2.1.19.1014
.1.3.6.1.2.1.2.2.1.19.1015
.1.3.6.1.2.1.2.2.1.19.1016
.1.3.6.1.2.1.2.2.1.19.1017
.1.3.6.1.2.1.2.2.1.19.1018
.1.3.6.1.2.1.2.2.1.19.1019
.1.3.6.1.2.1.2.2.1.19.1020
.1.3.6.1.2.1.2.2.1.19.1021
.1.3.6.1.2.1.2.2.1.19.1049
.1.3.6.1.2.1.2.2.1.19.1050
.1.3.6.1.2.1.2.2.1.19.1051
.1.3.6.1.2.1.2.2.1.19.1052
.1.3.6.1.2.1.2.2.1.19.15004
.1.3.6.1.2.1.2.2.1.20.1001
.1.3.6.1.2.1.2.2.1.20.1002
.1.3.6.1.2.1.2.2.1.20.1003
.1.3.6.1.2.1.2.2.1.20.1004
.1.3.6.1.2.1.2.2.1.20.1005
.1.3.6.1.2.1.2.2.1.20.1006
.1.3.6.1.2.1.2.2.1.20.1007
.1.3.6.1.2.1.2.2.1.20.1008
.1.3.6.1.2.1.2.2.1.20.1009
.1.3.6.1.2.1.2.2.1.20.1010
.1.3.6.1.2.1.2.2.1.20.1011
.1.3.6.1.2.1.2.2.1.20.1012
.1.3.6.1.2.1.2.2.1.20.1013
.1.3.6.1.2.1.2.2.1.20.1014
.1.3.6.1.2.1.2.2.1.20.1015
.1.3.6.1.2.1.2.2.1.20.1016
.1.3.6.1.2.1.2.2.1.20.1017
.1.3.6.1.2.1.2.2.1.20.1018
.1.3.6.1.2.1.2.2.1.20.1019
.1.3.6.1.2.1.2.2.1.20.1020
.1.3.6.1.2.1.2.2.1.20.1021
.1.3.6.1.2.1.2.2.1.20.1049
.1.3.6.1.2.1.2.2.1.20.1050
.1.3.6.1.2.1.2.2.1.20.1051
.1.3.6.1.2.1.2.2.1.20.1052
.1.3.6.1.2.1.2.2.1.20.15004
.1.3.6.1.2.1.25.2.3.1.6.1
.1.3.6.1.2.1.25.2.3.1.6.10
.1.3.6.1.2.1.25.2.3.1.6.3
.1.3.6.1.2.1.25.2.3.1.6.31
.1.3.6.1.2.1.25.2.3.1.6.36
.1.3.6.1.2.1.25.2.3.1.6.37
.1.3.6.1.2.1.25.2.3.1.6.38
.1.3.6.1.2.1.25.2.3.1.6.39
.1.3.6.1.2.1.25.2.3.1.6.40
.1.3.6.1.2.1.25.2.3.1.6.41
.1.3.6.1.2.1.25.2.3.1.6.42
.1.3.6.1.2.1.25.2.3.1.6.6
.1.3.6.1.2.1.25.2.3.1.6.7
.1.3.6.1.2.1.25.2.3.1.6.8
.1.3.6.1.2.1.25.3.3.1.2.196608
.1.3.6.1.2.1.25.3.3.1.2.196609
.1.3.6.1.2.1.25.3.3.1.2.196610
.1.3.6.1.2.1.25.3.3.1.2.196611
.1.3.6.1.2.1.31.1.1.1.10.1001
.1.3.6.1.2.1.31.1.1.1.10.1002
.1.3.6.1.2.1.31.1.1.1.10.1003
.1.3.6.1.2.1.31.1.1.1.10.1004
.1.3.6.1.2.1.31.1.1.1.10.1005
.1.3.6.1.2.1.31.1.1.1.10.1006
.1.3.6.1.2.1.31.1.1.1.10.1007
.1.3.6.1.2.1.31.1.1.1.10.1008
.1.3.6.1.2.1.31.1.1.1.10.1009
.1.3.6.1.2.1.31.1.1.1.10.1010
.1.3.6.1.2.1.31.1.1.1.10.1011
.1.3.6.1.2.1.31.1.1.1.10.1012
.1.3.6.1.2.1.31.1.1.1.10.1013
.1.3.6.1.2.1.31.1.1.1.10.1014
.1.3.6.1.2.1.31.1.1.1.10.1015
.1.3.6.1.2.1.31.1.1.1.10.1016
.1.3.6.1.2.1.31.1.1.1.10.1017
.1.3.6.1.2.1.31.1.1.1.10.1018
.1.3.6.1.2.1.31.1.1.1.10.1019
.1.3.6.1.2.1.31.1.1.1.10.1020
.1.3.6.1.2.1.31.1.1.1.10.1021
.1.3.6.1.2.1.31.1.1.1.10.1049
.1.3.6.1.2.1.31.1.1.1.10.1050
.1.3.6.1.2.1.31.1.1.1.10.1051
.1.3.6.1.2.1.31.1.1.1.10.1052
.1.3.6.1.2.1.31.1.1.1.10.15004
.1.3.6.1.2.1.31.1.1.1.6.1001
.1.3.6.1.2.1.31.1.1.1.6.1002
.1.3.6.1.2.1.31.1.1.1.6.1003
.1.3.6.1.2.1.31.1.1.1.6.1004
.1.3.6.1.2.1.31.1.1.1.6.1005
.1.3.6.1.2.1.31.1.1.1.6.1006
.1.3.6.1.2.1.31.1.1.1.6.1007
.1.3.6.1.2.1.31.1.1.1.6.1008
.1.3.6.1.2.1.31.1.1.1.6.1009
.1.3.6.1.2.1.31.1.1.1.6.1010
.1.3.6.1.2.1.31.1.1.1.6.1011
.1.3.6.1.2.1.31.1.1.1.6.1012
.1.3.6.1.2.1.31.1.1.1.6.1013
.1.3.6.1.2.1.31.1.1.1.6.1014
.1.3.6.1.2.1.31.1.1.1.6.1015
.1.3.6.1.2.1.31.1.1.1.6.1016
.1.3.6.1.2.1.31.1.1.1.6.1017
.1.3.6.1.2.1.31.1.1.1.6.1018
.1.3.6.1.2.1.31.1.1.1.6.1019
.1.3.6.1.2.1.31.1.1.1.6.1020
.1.3.6.1.2.1.31.1.1.1.6.1021
.1.3.6.1.2.1.31.1.1.1.6.1049
.1.3.6.1.2.1.31.1.1.1.6.1050
.1.3.6.1.2.1.31.1.1.1.6.1051
.1.3.6.1.2.1.31.1.1.1.6.1052
.1.3.6.1.2.1.31.1.1.1.6.15004
13:44:27.284993 IP 10.124.131.119.42677 > 10.91.31.200.161: C="community" GetRequest(948)
13:44:27.295092 IP 10.124.131.119.42677 > 10.91.31.200.161: C="community" GetRequest(951)
13:44:27.305742 IP 10.124.131.119.42677 > 10.91.31.200.161: C="community" GetRequest(951)
13:44:27.319130 IP 10.124.131.119.42677 > 10.91.31.200.161: C="community" GetRequest(968)
13:44:27.333884 IP 10.124.131.119.42677 > 10.91.31.200.161: C="community" GetRequest(177)
13:44:42.262463 IP 10.124.131.119.42677 > 10.91.31.200.161: C="community" GetRequest(948)
13:44:42.280136 IP 10.124.131.119.42677 > 10.91.31.200.161: C="community" GetRequest(951)
13:44:42.290800 IP 10.124.131.119.42677 > 10.91.31.200.161: C="community" GetRequest(951)
13:44:42.300894 IP 10.124.131.119.42677 > 10.91.31.200.161: C="community" GetRequest(968)
13:44:42.311113 IP 10.124.131.119.42677 > 10.91.31.200.161: C="community" GetRequest(177)
13:44:57.249259 IP 10.124.131.119.42677 > 10.91.31.200.161: C="community" GetRequest(948)
13:44:57.264393 IP 10.124.131.119.42677 > 10.91.31.200.161: C="community" GetRequest(951)
13:44:57.275180 IP 10.124.131.119.42677 > 10.91.31.200.161: C="community" GetRequest(951)
13:44:57.285302 IP 10.124.131.119.42677 > 10.91.31.200.161: C="community" GetRequest(968)
13:44:57.295366 IP 10.124.131.119.42677 > 10.91.31.200.161: C="community" GetRequest(177)
13:45:02.163338 IP 10.124.3.25.48024 > 10.91.31.200.161: C="community" GetRequest(155)
13:45:02.163611 IP 10.124.3.25.48024 > 10.91.31.200.161: C="community" GetRequest(155)
13:45:02.163961 IP 10.124.3.25.48024 > 10.91.31.200.161: C="community" GetRequest(155)
13:45:02.164227 IP 10.124.3.25.48024 > 10.91.31.200.161: C="community" GetRequest(155)
13:45:02.164449 IP 10.124.3.25.48024 > 10.91.31.200.161: C="community" GetRequest(155)
13:45:02.164676 IP 10.124.3.25.48024 > 10.91.31.200.161: C="community" GetRequest(155)
13:45:02.164910 IP 10.124.3.25.48024 > 10.91.31.200.161: C="community" GetRequest(155)
13:45:02.165128 IP 10.124.3.25.48024 > 10.91.31.200.161: C="community" GetRequest(46)
13:45:03.915454 IP 10.124.3.19.41627 > 10.91.31.200.161: C="community" GetRequest(148)
13:45:03.915677 IP 10.124.3.19.41627 > 10.91.31.200.161: C="community" GetRequest(148)
13:45:03.915896 IP 10.124.3.19.41627 > 10.91.31.200.161: C="community" GetRequest(148)
13:45:03.916126 IP 10.124.3.19.41627 > 10.91.31.200.161: C="community" GetRequest(148)
13:45:03.916342 IP 10.124.3.19.41627 > 10.91.31.200.161: C="community" GetRequest(148)
13:45:03.916568 IP 10.124.3.19.41627 > 10.91.31.200.161: C="community" GetRequest(148)
13:45:03.916799 IP 10.124.3.19.41627 > 10.91.31.200.161: C="community" GetRequest(148)
13:45:03.917017 IP 10.124.3.19.41627 > 10.91.31.200.161: C="community" GetRequest(45)
13:45:04.496629 IP 10.124.3.15.38182 > 10.91.31.200.161: C="community" GetRequest(154)
13:45:04.496673 IP 10.124.3.15.38182 > 10.91.31.200.161: C="community" GetRequest(145)
13:45:04.496826 IP 10.124.3.15.38182 > 10.91.31.200.161: C="community" GetRequest(115)
13:45:07.998370 IP 10.124.3.25.36799 > 10.91.31.200.161: C="community" GetRequest(285)
13:45:07.998752 IP 10.124.3.25.36799 > 10.91.31.200.161: C="community" GetRequest(285)
13:45:07.999151 IP 10.124.3.25.36799 > 10.91.31.200.161: C="community" GetRequest(285)
13:45:07.999538 IP 10.124.3.25.36799 > 10.91.31.200.161: C="community" GetRequest(285)
13:45:07.999932 IP 10.124.3.25.36799 > 10.91.31.200.161: C="community" GetRequest(285)
13:45:08.000339 IP 10.124.3.25.36799 > 10.91.31.200.161: C="community" GetRequest(285)
13:45:08.000727 IP 10.124.3.25.36799 > 10.91.31.200.161: C="community" GetRequest(199)
13:45:12.281349 IP 10.124.131.119.42677 > 10.91.31.200.161: C="community" GetRequest(948)
13:45:12.293862 IP 10.124.131.119.42677 > 10.91.31.200.161: C="community" GetRequest(951)
13:45:12.304647 IP 10.124.131.119.42677 > 10.91.31.200.161: C="community" GetRequest(951)
13:45:12.314915 IP 10.124.131.119.42677 > 10.91.31.200.161: C="community" GetRequest(968)
13:45:12.325422 IP 10.124.131.119.42677 > 10.91.31.200.161: C="community" GetRequest(177)
13:45:27.217954 IP 10.124.131.119.42677 > 10.91.31.200.161: C="community" GetRequest(948)
13:45:27.228824 IP 10.124.131.119.42677 > 10.91.31.200.161: C="community" GetRequest(951)
13:45:27.244431 IP 10.124.131.119.42677 > 10.91.31.200.161: C="community" GetRequest(951)
13:45:27.256622 IP 10.124.131.119.42677 > 10.91.31.200.161: C="community" GetRequest(968)
13:45:27.267542 IP 10.124.131.119.42677 > 10.91.31.200.161: C="community" GetRequest(177)
13:45:42.207098 IP 10.124.131.119.42677 > 10.91.31.200.161: C="community" GetRequest(948)
13:45:42.217119 IP 10.124.131.119.42677 > 10.91.31.200.161: C="community" GetRequest(951)
13:45:42.227534 IP 10.124.131.119.42677 > 10.91.31.200.161: C="community" GetRequest(951)
13:45:42.240113 IP 10.124.131.119.42677 > 10.91.31.200.161: C="community" GetRequest(968)
13:45:42.250594 IP 10.124.131.119.42677 > 10.91.31.200.161: C="community" GetRequest(177)
13:45:57.253592 IP 10.124.131.119.42677 > 10.91.31.200.161: C="community" GetRequest(948)
13:45:57.263890 IP 10.124.131.119.42677 > 10.91.31.200.161: C="community" GetRequest(951)
13:45:57.277747 IP 10.124.131.119.42677 > 10.91.31.200.161: C="community" GetRequest(951)
13:45:57.287934 IP 10.124.131.119.42677 > 10.91.31.200.161: C="community" GetRequest(968)
13:45:57.298098 IP 10.124.131.119.42677 > 10.91.31.200.161: C="community" GetRequest(177)
13:46:02.438932 IP 10.124.3.25.53672 > 10.91.31.200.161: C="community" GetRequest(155)
13:46:02.439164 IP 10.124.3.25.53672 > 10.91.31.200.161: C="community" GetRequest(155)
13:46:02.439380 IP 10.124.3.25.53672 > 10.91.31.200.161: C="community" GetRequest(155)
13:46:02.439610 IP 10.124.3.25.53672 > 10.91.31.200.161: C="community" GetRequest(155)
13:46:02.439829 IP 10.124.3.25.53672 > 10.91.31.200.161: C="community" GetRequest(155)
13:46:02.440047 IP 10.124.3.25.53672 > 10.91.31.200.161: C="community" GetRequest(155)
13:46:02.440276 IP 10.124.3.25.53672 > 10.91.31.200.161: C="community" GetRequest(155)
13:46:02.440494 IP 10.124.3.25.53672 > 10.91.31.200.161: C="community" GetRequest(46)
13:46:03.536727 IP 10.124.3.19.51281 > 10.91.31.200.161: C="community" GetRequest(148)
13:46:03.536944 IP 10.124.3.19.51281 > 10.91.31.200.161: C="community" GetRequest(148)
13:46:03.537167 IP 10.124.3.19.51281 > 10.91.31.200.161: C="community" GetRequest(148)
13:46:03.537387 IP 10.124.3.19.51281 > 10.91.31.200.161: C="community" GetRequest(148)
13:46:03.537609 IP 10.124.3.19.51281 > 10.91.31.200.161: C="community" GetRequest(148)
13:46:03.537834 IP 10.124.3.19.51281 > 10.91.31.200.161: C="community" GetRequest(148)
13:46:03.538057 IP 10.124.3.19.51281 > 10.91.31.200.161: C="community" GetRequest(148)
13:46:03.538274 IP 10.124.3.19.51281 > 10.91.31.200.161: C="community" GetRequest(45)
13:46:03.606741 IP 10.124.3.15.52216 > 10.91.31.200.161: C="community" GetRequest(154)
13:46:03.606775 IP 10.124.3.15.52216 > 10.91.31.200.161: C="community" GetRequest(145)
13:46:03.608614 IP 10.124.3.15.52216 > 10.91.31.200.161: C="community" GetRequest(115)
13:46:07.753211 IP 10.124.3.25.45153 > 10.91.31.200.161: C="community" GetRequest(285)
13:46:07.753608 IP 10.124.3.25.45153 > 10.91.31.200.161: C="community" GetRequest(285)
13:46:07.754032 IP 10.124.3.25.45153 > 10.91.31.200.161: C="community" GetRequest(285)
13:46:07.754422 IP 10.124.3.25.45153 > 10.91.31.200.161: C="community" GetRequest(285)
13:46:07.754825 IP 10.124.3.25.45153 > 10.91.31.200.161: C="community" GetRequest(285)
13:46:07.755244 IP 10.124.3.25.45153 > 10.91.31.200.161: C="community" GetRequest(285)
13:46:07.755653 IP 10.124.3.25.45153 > 10.91.31.200.161: C="community" GetRequest(199)
13:46:12.218068 IP 10.124.131.119.42677 > 10.91.31.200.161: C="community" GetRequest(948)
13:46:12.234673 IP 10.124.131.119.42677 > 10.91.31.200.161: C="community" GetRequest(951)
13:46:12.244945 IP 10.124.131.119.42677 > 10.91.31.200.161: C="community" GetRequest(951)
13:46:12.255700 IP 10.124.131.119.42677 > 10.91.31.200.161: C="community" GetRequest(968)
13:46:12.269333 IP 10.124.131.119.42677 > 10.91.31.200.161: C="community" GetRequest(177)
13:46:27.225924 IP 10.124.131.119.42677 > 10.91.31.200.161: C="community" GetRequest(948)
13:46:27.236067 IP 10.124.131.119.42677 > 10.91.31.200.161: C="community" GetRequest(951)
13:46:27.247061 IP 10.124.131.119.42677 > 10.91.31.200.161: C="community" GetRequest(951)
13:46:27.257443 IP 10.124.131.119.42677 > 10.91.31.200.161: C="community" GetRequest(968)
13:46:27.290869 IP 10.124.131.119.42677 > 10.91.31.200.161: C="community" GetRequest(177)
13:46:42.220605 IP 10.124.131.119.42677 > 10.91.31.200.161: C="community" GetRequest(948)
13:46:42.230625 IP 10.124.131.119.42677 > 10.91.31.200.161: C="community" GetRequest(951)
13:46:42.242948 IP 10.124.131.119.42677 > 10.91.31.200.161: C="community" GetRequest(951)
13:46:42.254625 IP 10.124.131.119.42677 > 10.91.31.200.161: C="community" GetRequest(968)
13:46:42.267322 IP 10.124.131.119.42677 > 10.91.31.200.161: C="community" GetRequest(177)
13:46:57.220025 IP 10.124.131.119.42677 > 10.91.31.200.161: C="community" GetRequest(948)
13:46:57.231025 IP 10.124.131.119.42677 > 10.91.31.200.161: C="community" GetRequest(951)
13:46:57.242639 IP 10.124.131.119.42677 > 10.91.31.200.161: C="community" GetRequest(951)
13:46:57.253201 IP 10.124.131.119.42677 > 10.91.31.200.161: C="community" GetRequest(968)
13:46:57.263285 IP 10.124.131.119.42677 > 10.91.31.200.161: C="community" GetRequest(177)
13:47:02.446163 IP 10.124.3.25.56127 > 10.91.31.200.161: C="community" GetRequest(155)
13:47:02.446546 IP 10.124.3.25.56127 > 10.91.31.200.161: C="community" GetRequest(155)
13:47:02.446938 IP 10.124.3.25.56127 > 10.91.31.200.161: C="community" GetRequest(155)
13:47:02.447327 IP 10.124.3.25.56127 > 10.91.31.200.161: C="community" GetRequest(155)
13:47:02.447729 IP 10.124.3.25.56127 > 10.91.31.200.161: C="community" GetRequest(155)
13:47:02.448125 IP 10.124.3.25.56127 > 10.91.31.200.161: C="community" GetRequest(155)
13:47:02.448529 IP 10.124.3.25.56127 > 10.91.31.200.161: C="community" GetRequest(155)
13:47:02.448936 IP 10.124.3.25.56127 > 10.91.31.200.161: C="community" GetRequest(46)
